nome_parceiro,nome_produto,count_contratos,qtd_acumulado,porcentagem,porcentagem_acumulada,classe,date_inicio_contrato_mais_rescente,pontualizado
Light - Valore Investimentos Imobiliarios LTDA,Light,368,368,8.4754,8.4754,A,2026-06-01,1.0
MBASTOS CORRETORA DE IMOVEIS LTDA.,Smart,238,606,5.4813,13.9567,A,2026-06-08,1.0
IMOVELVESP IMOBILIÁRIA LTDA,Smart,188,794,4.3298,18.2865,A,2026-05-20,1.0
EMPREENDIMENTOS IMOBILIARIOS ADRIANO E LUCILEIA LTDA,Smart,147,941,3.3855,21.672,A,2026-05-23,1.0
Light Safe - JACQUELINE IMOVEIS EMPREENDIMENTOS IMOBILIARIOS LTDA,Light,140,1081,3.2243,24.8964,A,2026-05-11,1.0
VIA M EMPREENDIMENTOS IMOBILIARIOS LTDA,Smart,136,1217,3.1322,28.0286,A,2026-06-08,1.0
"MMWM ASSESSORIA IMOBILIARIA LTDA, MMWM CRECI 7062-J ",Full,120,1337,2.7637,30.7923,A,2026-05-14,1.0
ALUGGAI ADMINISTRACAO DE IMOVEIS LTDA - IGM,Smart,103,1440,2.3722,33.1644,A,2026-05-05,2.0
IMOVEIS BRUNO LARA LTDA,Smart,103,1543,2.3722,35.5366,A,2026-05-22,1.0
SIMONE CONRADO TIMMERMANN NEGOCIOS IMOBILIARIOS,Smart,102,1645,2.3491,37.8858,A,2027-12-26,1.0
CLASS NEGÓCIOS IMOBILIARIOS LTDA,Light,101,1746,2.3261,40.2119,A,2026-06-01,1.0
UPMWA LOCACOES IMOBILIARIAS LTDA,Full,96,1842,2.211,42.4228,A,2026-05-22,1.0
NOVA SOLAR EMPREENDIMENTOS IMOBILIÁRIOS S/S LTDA,Smart,92,1934,2.1188,44.5417,A,2026-05-22,1.0
UPMWA LOCACOES IMOBILIARIAS LTDA,Smart,86,2020,1.9807,46.5223,A,2026-05-24,1.0
BLUME NEGOCIOS IMOBILIARIOS LTDA,Full,80,2100,1.8425,48.3648,A,2026-05-15,2.0
DALTON AQUILES IMÓVEIS LTDA,Smart,76,2176,1.7503,50.1152,A,2026-05-20,2.0
GF IMOVEIS LTDA,Light,71,2247,1.6352,51.7503,A,2026-04-17,1.0
BRUM ADMINISTRADORA DE IMOVEIS LTDA,Smart,71,2318,1.6352,53.3855,A,2026-03-09,2.0
HELLO NEGOCIOS IMOBILIARIOS LTDA,Smart,62,2380,1.4279,54.8135,A,2026-05-04,2.0
LOUNGE NEGOCIOS IMOBILIARIOS LTDA,Smart,61,2441,1.4049,56.2183,A,2026-06-01,2.0
MONTREAL IMOVEIS LTDA,Smart,59,2500,1.3588,57.5772,A,2026-05-20,2.0
CIA DO IMOVEL LTDA,Smart,58,2558,1.3358,58.9129,A,2026-05-04,2.0
MAIA FERNANDES NEGOCIOS IMOBILIARIOS LTDA,Smart,54,2612,1.2437,60.1566,A,2026-05-08,2.0
Light- LUAGGE IMÓVEIS LTDA,Light,53,2665,1.2206,61.3772,A,2026-03-01,1.0
LEHOME NEGOCIOS IMOBILIARIOS LTDA,Smart,52,2717,1.1976,62.5749,A,2026-06-01,2.0
Light Growth - RODRIGUES E SILVA EMPREENDIMENTOS IMOBILIARIOS LTDA,Light,50,2767,1.1515,63.7264,A,2026-05-25,1.0
Light Safe - OTTO HOUSE LAR & PATRIMONIO LTDA,Light,48,2815,1.1055,64.8319,A,2026-04-15,2.0
"MMWM ASSESSORIA IMOBILIARIA LTDA, MMWM CRECI 7062-J ",Smart,46,2861,1.0594,65.8913,A,2024-11-09,1.0
RSANCHES IMÓVEIS SERVIÇOS DE CORRETAGEM LTDA,Smart,44,2905,1.0134,66.9047,A,2026-04-30,2.0
ANDREA DUTRA NEGOCIOS IMOBILIARIOS LTDA,Smart,42,2947,0.9673,67.8719,A,2026-04-29,2.0
LIGHT - AM IMOVEIS LTDA,Light,41,2988,0.9443,68.8162,A,2026-05-15,1.0
ELDORADO EMPREENDIMENTOS IMOBILIÁRIOS LTDA ME,Light,40,3028,0.9212,69.7374,A,2025-07-20,2.0
UP ESTATE IMÓVEIS LTDA.,Smart,39,3067,0.8982,70.6357,A,2026-04-22,1.0
IMOBILIARIA CONTAGEM LTDA,Smart,36,3103,0.8291,71.4648,A,2026-05-23,1.0
GOLDEN IMÓVEIS LTDA,Full,36,3139,0.8291,72.2939,A,2025-09-09,2.0
MARIANE HADDAD LTDA,Smart,36,3175,0.8291,73.123,A,2026-05-18,2.0
TUTTO TECNOLOGIA E GESTÃO LTDA,Full,35,3210,0.8061,73.9291,A,2026-01-03,2.0
MAURI KESSLER LTDA,Full,34,3244,0.783,74.7121,A,2026-05-25,2.0
TUTTO TECNOLOGIA E GESTÃO LTDA,Smart,33,3277,0.76,75.4721,A,2026-06-01,2.0
EXPERTISE NEGOCIOS IMOBILIARIOS LTDA,Full,32,3309,0.737,76.2091,A,2026-04-28,1.0
4IMOB IMOBILIÁRIA LTDA,Smart,31,3340,0.714,76.9231,A,2026-05-03,1.0
FLORA IMÓVEIS LTDA,Full,30,3370,0.6909,77.614,A,2026-03-08,2.0
JAZZ IMOBILIARIA LTDA,Smart,27,3397,0.6218,78.2358,A,2026-05-25,1.0
RAFAEL BARROS PASCHOALIM LTDA,Full,27,3424,0.6218,78.8577,A,2026-05-15,2.0
SEIVA NEGOCIOS IMOBILIARIOS LTDA,Smart,26,3450,0.5988,79.4565,A,2026-05-25,1.0
THAIS VERISSIMO ONOFRE ME,Full,24,3474,0.5527,80.0092,B,2026-05-12,1.0
Light Safe - Adriano Augusto Dos Santos Nunes,Light,23,3497,0.5297,80.5389,B,2025-07-30,2.0
M. H. J. DOS SANTOS,Full,23,3520,0.5297,81.0686,B,2125-07-18,1.0
ELO IMOBILIARIA LTDA,Light,23,3543,0.5297,81.5983,B,2026-03-03,1.0
INNOVIMOB CONSULTORIA MERCADOLOGICA E NEGOCIOS IMOBILIARIOS LTDA,Full,22,3565,0.5067,82.105,B,2026-03-16,2.0
RG IMOVEIS LTDA,Smart,20,3585,0.4606,82.5656,B,2024-12-09,1.0
LUÍS FELIPE ARAÚJO GALVÃO DOS SANTOS,Full,20,3605,0.4606,83.0263,B,2026-05-08,1.0
IMOWEFFER SOLUCOES IMOBILIARIAS LTDA,Full,20,3625,0.4606,83.4869,B,2026-05-15,1.0
Light Growth - RAPHAEL IMÓVEIS LTDA,Light,18,3643,0.4146,83.9014,B,2026-04-24,1.0
SOU IMOVEIS GESTAO DE NEGOCIOS IMOBILIARIOS LTDA,Smart,17,3660,0.3915,84.293,B,2026-05-01,1.0
VIA M EMPREENDIMENTOS IMOBILIARIOS LTDA,Full,16,3676,0.3685,84.6614,B,2024-11-09,1.0
NIVALDO ZANON S JUNIOR CONSULTORIA IMOBILIÁRIA,Full,16,3692,0.3685,85.0299,B,2026-04-10,2.0
FS ASCANI – CONSULTORIA – INTERMEDIAÇÃO DE NEGÓCIOS LTDA,Smart,15,3707,0.3455,85.3754,B,2025-10-10,1.0
DELREY IMOBILIÁRIA LTDA.,Full,15,3722,0.3455,85.7209,B,2026-05-29,1.0
ELITE NEGOCIOS IMOBILIARIOS LTDA,Smart,15,3737,0.3455,86.0663,B,2026-05-20,1.0
ISMAEL MARIANO,Smart,14,3751,0.3224,86.3888,B,2025-11-10,1.0
ABRAKI ASSESSORIA IMOBILIARIA LTDA,Smart,14,3765,0.3224,86.7112,B,2026-01-16,1.0
IGR NEGOCIOS IMOBILIARIOS E ADMINISTRADORA LTDA,Full,14,3779,0.3224,87.0336,B,2025-08-20,1.0
IMOBILIÁRIA MOTTA EMPREENDIMENTOS LTDA.,Smart,13,3792,0.2994,87.333,B,2025-08-09,1.0
SMART BROKERS CONSULTORIA E INVESTIMENTOS IMOBILIARIOS LTDA,Smart,13,3805,0.2994,87.6324,B,2026-02-27,1.0
FLORA IMÓVEIS LTDA,Smart,12,3817,0.2764,87.9088,B,2024-05-20,2.0
LIDIANE PINTO DE CERQUEIRA,Full,12,3829,0.2764,88.1852,B,2026-03-06,1.0
Light Growth - ERIK CARLOS BIGATTO,Light,12,3841,0.2764,88.4615,B,2025-10-11,1.0
VELOPE IMOVEIS LTDA,Smart,11,3852,0.2533,88.7149,B,2026-04-09,1.0
Light Safe - SOLAR ADMINISTRADORA DE BENS IMOVEIS LTDA - EPP,Smart,11,3863,0.2533,88.9682,B,2023-10-20,1.0
LMWM ASSESSORIA IMOBILIÁRIA LTDA.,Smart,11,3874,0.2533,89.2216,B,2024-11-04,1.0
WE IMOBILIARIA LTDA,Full,11,3885,0.2533,89.4749,B,2026-03-15,1.0
LUIS CARLOS MARTINS,Smart,11,3896,0.2533,89.7282,B,2026-05-11,1.0
Light Safe - RENATA FERNANDES SERVICOS IMOBILIARIOS LTDA,Light,11,3907,0.2533,89.9816,B,2026-05-15,1.0
RIO CAPITAL CONSULTORIA IMOBILIARIA LTDA,Light,11,3918,0.2533,90.2349,B,2025-05-27,1.0
THAIS VERISSIMO ONOFRE ME,Smart,10,3928,0.2303,90.4652,B,2024-05-10,1.0
LIGHT GROWTH - IMOBILIARIA STEVAUX GALVAO LTDA,Light,10,3938,0.2303,90.6955,B,2026-02-12,1.0
Light Safe - SIGASP NEGOCIOS IMOBILIARIOS LTDA.,Light,10,3948,0.2303,90.9258,B,2025-01-18,1.0
Light Growth - A. A. PEREIRA ASSESSORIA IMOBILIARIA,Light,10,3958,0.2303,91.1561,B,2026-05-09,1.0
LMWM ASSESSORIA IMOBILIÁRIA LTDA.,Full,10,3968,0.2303,91.3865,B,2025-08-01,1.0
LINEARE NEGOCIOS IMOBILIARIOS LTDA,Smart,10,3978,0.2303,91.6168,B,2026-04-02,2.0
KMK10 IMOVEIS LTDA,Full,10,3988,0.2303,91.8471,B,2026-05-16,2.0
ALUGGAI ADMINISTRACAO DE IMOVEIS LTDA - IGL,Smart,10,3998,0.2303,92.0774,B,2025-11-12,2.0
INNOVIMOB CONSULTORIA MERCADOLOGICA E NEGOCIOS IMOBILIARIOS LTDA,Smart,9,4007,0.2073,92.2847,B,2025-03-10,1.0
M. FERRO DE OLIVEIRA CORRETAGEM DE IMOVEIS LTDA,Light,8,4015,0.1842,92.4689,B,2025-03-06,1.0
A-1 ASSOCIATE IMOVEIS LTDA,Full,8,4023,0.1842,92.6532,B,2025-09-01,2.0
QDEZ NEGOCIOS IMOBILIARIOS LTDA,Smart,8,4031,0.1842,92.8374,B,2025-05-03,1.0
ACVIANA EMPREENDIMENTOS IMOBILIÁRIOS LTDA,Smart,8,4039,0.1842,93.0216,B,2026-02-16,1.0
ALUGGAI ADMINISTRACAO DE IMOVEIS LTDA - IGP,Smart,8,4047,0.1842,93.2059,B,2025-12-18,2.0
Ligth Safe - AB NEGOCIOS IMOBILIARIOS LTDA,Light,8,4055,0.1842,93.3901,B,2025-05-11,1.0
CONNECT GESTÃO E MEDIAÇÃO IMOBILIÁRIA LTDA,Smart,7,4062,0.1612,93.5514,B,2025-12-01,1.0
AGENCIE IMOVEIS TECNOLOGIA E SERVICOS IMOBILIARIOS LTDA.,Smart,7,4069,0.1612,93.7126,B,2025-05-06,1.0
OCEANICA IMOBILIARIA LTDA,Full,7,4076,0.1612,93.8738,B,2026-03-17,1.0
MULTIPLO ADMINISTRADORA DE IMOVEIS LTDA,Smart,7,4083,0.1612,94.035,B,2026-04-06,1.0
MULTIPLO ADMINISTRADORA DE IMOVEIS LTDA,Light,7,4090,0.1612,94.1962,B,2026-05-15,1.0
PUIATTI SOLUÇÕES IMOBILIÁRIAS LTDA,Smart,6,4096,0.1382,94.3344,B,2025-04-11,1.0
REAL ESTATE RENT IMOVEIS LTDA,Smart,6,4102,0.1382,94.4726,B,2024-11-12,1.0
DELREY IMOBILIÁRIA LTDA.,Smart,6,4108,0.1382,94.6108,B,2025-07-20,1.0
SIMONE CONRADO TIMMERMANN NEGOCIOS IMOBILIARIOS,Full,6,4114,0.1382,94.749,B,2024-11-05,1.0
Light Safe - LUIZ CARLOS DOS SANTOS MARANGONI,Light,6,4120,0.1382,94.8871,B,2026-03-06,1.0
BONTEMPO IMOBILIARIA LTDA,Smart,6,4126,0.1382,95.0253,C,2026-06-08,2.0
CASTRO E BITENCOURT NEGÓCIOS IMOBILIÁRIOS LTDA,Smart,6,4132,0.1382,95.1635,C,2026-04-01,2.0
A-1 ASSOCIATE IMOVEIS LTDA,Smart,5,4137,0.1152,95.2787,C,2024-06-01,1.0
OPENHOUSE CONSULTORIA IMOBILIÁRIA,Smart,5,4142,0.1152,95.3938,C,2025-01-09,1.0
FORT LEST IMÓVEIS EIRELI,Smart,5,4147,0.1152,95.509,C,2023-06-06,1.0
MALTA CONSULTORIA E ENGENHARIA LTDA,Full,5,4152,0.1152,95.6241,C,2026-01-10,1.0
KIKO LUZA VENDAS IMOVEIS E TECNOLOGIA LTDA,Smart,5,4157,0.1152,95.7393,C,2026-05-21,2.0
DOMINGOS IMÓVEIS - DIEGO RAFAELI DOS SANTOS LTDA,Smart,5,4162,0.1152,95.8544,C,2026-05-13,1.0
SERGIO JOSE MACHADO- IMOVEIS,Smart,5,4167,0.1152,95.9696,C,2026-03-16,1.0
ACTION GROUP SOLUTIONS LTDA,Full,4,4171,0.0921,96.0617,C,2026-02-13,1.0
LUÍS FELIPE ARAÚJO GALVÃO DOS SANTOS,Smart,4,4175,0.0921,96.1538,C,2024-05-02,1.0
VARANDA NEGÓCIOS IMOBILIÁRIOS LTDA,Smart,4,4179,0.0921,96.246,C,2024-04-07,1.0
Ítalo Francisco Nogueira De Castro,Full,4,4183,0.0921,96.3381,C,2026-02-23,1.0
Light Growth - REINALDO DE CASTRO DINIZ,Light,4,4187,0.0921,96.4302,C,2026-01-23,1.0
FLAT IMOBILIÁRIA LTDA.,Light,4,4191,0.0921,96.5223,C,2025-01-23,1.0
888 GESTAO EMPRESARIAL LTDA,Smart,4,4195,0.0921,96.6145,C,2026-05-08,1.0
KEILA ALVES DA SILVA,Smart,4,4199,0.0921,96.7066,C,2025-07-08,1.0
NOVA SOLAR EMPREENDIMENTOS IMOBILIÁRIOS S/S LTDA,Full,4,4203,0.0921,96.7987,C,2026-02-01,1.0
CALEFI IMÓVEIS LTDA,Smart,3,4206,0.0691,96.8678,C,2026-04-13,1.0
IMPERIALE INTELIGENCIA EM NEGOCIOS IMOBILIARIOS LTDA,Smart,3,4209,0.0691,96.9369,C,2026-04-16,1.0
R.A.J.B. GESTÃO IMOBILIÁRIA LTDA,Smart,3,4212,0.0691,97.006,C,2026-05-13,1.0
V&V NEGÓCIOS IMOBILIÁRIOS LTDA,Smart,3,4215,0.0691,97.0751,C,2025-06-20,1.0
CONSTRUIR IMÓVEIS LTDA,Smart,3,4218,0.0691,97.1442,C,2022-09-29,1.0
YVES NAVARRO DE SOUZA NEGÓCIOS IMOBILIÁRIOS LTDA,Smart,3,4221,0.0691,97.2133,C,2024-05-27,1.0
PS REALTY CONSULTORIA LTDA,Smart,3,4224,0.0691,97.2824,C,2024-11-01,1.0
Light Growth - PERFECTA RIO CONSULTORIA IMOBILIARIA LTDA,Light,3,4227,0.0691,97.3515,C,2026-02-13,1.0
Light Safe - META NEGOCIOS IMOBILIARIOS LTDA,Light,3,4230,0.0691,97.4205,C,2024-11-13,1.0
Light Safe - CEVILLE IMOVEIS LTDA,Light,3,4233,0.0691,97.4896,C,2025-04-09,1.0
GS IMOBILIARIA LTDA,Full,3,4236,0.0691,97.5587,C,2024-11-04,1.0
Ligth Growth - HERCULES IMOVEIS LTDA,Light,3,4239,0.0691,97.6278,C,2024-09-23,1.0
BMTP INVEST NEGOCIOS IMOBILIARIOS LTDA,Light,3,4242,0.0691,97.6969,C,2026-04-30,1.0
RAFAEL DE CAMPOS PONTES,Smart,3,4245,0.0691,97.766,C,2025-05-15,1.0
CREDENCOL – ASSESSORIA DE CRÉDITOS E NEGÓCIOS IMOBILIÁRIOS LTDA,Smart,3,4248,0.0691,97.8351,C,2026-05-13,2.0
BEST IMOBI ASSESSORIA IMOBILIARIA LTDA,Full,3,4251,0.0691,97.9042,C,2026-01-17,1.0
RMX GESTAO IMOBILIARIA E INVESTIMENTOS LTDA,Smart,3,4254,0.0691,97.9733,C,2026-02-01,1.0
FR ALVES IMOBILIARIA ME,Smart,2,4256,0.0461,98.0193,C,2024-12-09,1.0
MARCOS CAVALCANTE CRUZ,Smart,2,4258,0.0461,98.0654,C,2023-08-07,1.0
PEDRO TAVARES IMOVEIS,Smart,2,4260,0.0461,98.1115,C,2025-02-10,1.0
PARCERIA ASSESSORIA IMOBILIÁRIA LTDA.,Smart,2,4262,0.0461,98.1575,C,2026-02-14,1.0
TOC 2 IMOBILIÁRIA LTDA,Smart,2,4264,0.0461,98.2036,C,2022-10-14,1.0
DOUGLAS FERREIRA DOS SANTOS,Smart,2,4266,0.0461,98.2497,C,2024-04-29,1.0
MINAS ADMINISTRAÇÃO E CORRETAGEM DE IMÓVEIS,Smart,2,4268,0.0461,98.2957,C,2025-01-24,1.0
MACHADO CORREA IMOBILIARIA LTDA.,Smart,2,4270,0.0461,98.3418,C,2023-11-22,1.0
CEDRO NEGÓCIOS IMOBILIÁRIOS LTDA,Smart,2,4272,0.0461,98.3878,C,2025-01-15,1.0
WE IMOBILIARIA LTDA,Smart,2,4274,0.0461,98.4339,C,2024-04-30,1.0
ELISANGELA APARECIDA DOMINGUES NEGOCIOS IMOBILIARIOS,Smart,2,4276,0.0461,98.48,C,2025-06-10,1.0
MAURICIO L. KWASNICKA CONSULTORIA IMOBILIÁRIA,Smart,2,4278,0.0461,98.526,C,2026-04-17,1.0
MALTA CONSULTORIA E ENGENHARIA LTDA,Smart,2,4280,0.0461,98.5721,C,2024-04-27,1.0
MARCOS AURELIO FERREIRA,Full,2,4282,0.0461,98.6181,C,2025-11-25,1.0
Ligth Safe - ULYSSES TEIXEIRA FERREIRA,Light,2,4284,0.0461,98.6642,C,2024-09-20,1.0
FAIR PLAY GESTAO DE PATRIMONIOS E CONDOMINIOS LTDA,Smart,2,4286,0.0461,98.7103,C,2026-06-01,2.0
DUCALE NEGOCIOS IMOBILIARIOS LTDA,Full,2,4288,0.0461,98.7563,C,2025-08-11,1.0
SERGIO JOSE MACHADO- IMOVEIS,Full,2,4290,0.0461,98.8024,C,2025-05-16,1.0
CATEF EMPREENDIMENTOS LTDA,Full,2,4292,0.0461,98.8485,C,2026-05-18,1.0
SERGIO AUGUSTO STORCH,Light,2,4294,0.0461,98.8945,C,2025-09-01,1.0
GUILHERME MENDES,Smart,2,4296,0.0461,98.9406,C,2024-11-01,1.0
Teste Parceiro UP - Full,Smart,1,4297,0.023,98.9636,C,2025-10-01,1.0
Rones Imóveis,Smart,1,4298,0.023,98.9866,C,2022-01-03,1.0
ANDRÉ RODRIGUES DE SOUZA CARDOSO JUNIOR,Smart,1,4299,0.023,99.0097,C,2023-02-07,1.0
RESULTA IMÓVEIS SOLUÇÕES IMOBILIÁRIAS LTDA.,Smart,1,4300,0.023,99.0327,C,2024-02-05,1.0
CURATOLO IMÓVEIS LTDA,Smart,1,4301,0.023,99.0557,C,2023-11-01,1.0
ACTION GROUP SOLUTIONS LTDA,Smart,1,4302,0.023,99.0788,C,2023-05-11,1.0
CONSTRUIR IMÓVEIS LTDA,Full,1,4303,0.023,99.1018,C,2024-06-07,1.0
Light Safe - DC ADMINISTRADORA DE IMOVEIS E SERVICO DE INFORMACAO CADASTRAL LTDA,Light,1,4304,0.023,99.1248,C,2025-02-09,1.0
PAULO DIAS IMOVEIS LTDA,Full,1,4305,0.023,99.1479,C,2026-02-08,1.0
MARCOS AURELIO FERREIRA,Smart,1,4306,0.023,99.1709,C,2024-02-01,1.0
E. I. DA S. ROCHA & D. C. DA SILVA LTDA,Smart,1,4307,0.023,99.1939,C,2023-06-06,1.0
CHAMOUN IMÓVEIS LTDA.,Smart,1,4308,0.023,99.217,C,2024-04-23,1.0
COSTA ANDRADE NEGOCIOS IMOBILIARIOS LTDA,Smart,1,4309,0.023,99.24,C,2023-10-04,1.0
LIDIANE PINTO DE CERQUEIRA,Smart,1,4310,0.023,99.263,C,2023-10-20,1.0
NBL CONSULTORIA IMOBILIARIA LTDA,Smart,1,4311,0.023,99.286,C,2023-08-10,1.0
DIAS HOLDING APOIO ADMINISTRATIVO LTDA,Smart,1,4312,0.023,99.3091,C,2024-12-02,1.0
ANA ALICE MARTINS DE SOUZA,Smart,1,4313,0.023,99.3321,C,2024-02-26,1.0
ELISA TOMIE HATADANI,Smart,1,4314,0.023,99.3551,C,2024-09-16,1.0
DA CONSULTORIA E ASSESSORIA LTDA,Smart,1,4315,0.023,99.3782,C,2025-03-21,1.0
BOMYER CONSULTORIA IMOBILIARIA LTDA,Smart,1,4316,0.023,99.4012,C,2024-07-09,1.0
LIGHT SAFE - OSMAR PINTO CORRETORA DE IMOVEIS LTDA,Light,1,4317,0.023,99.4242,C,2024-05-06,1.0
CLEONICE FARIAS DE OLIVEIRA,Full,1,4318,0.023,99.4473,C,2024-06-15,1.0
Light Safe - QUADRA 3 ASSESSORIA ADMINISTRATIVA LTDA,Light,1,4319,0.023,99.4703,C,2024-08-26,1.0
Light Safe - BACELO ADVOGADOS,Light,1,4320,0.023,99.4933,C,2024-06-20,1.0
Jamerson de Albuquerque Leal,Full,1,4321,0.023,99.5164,C,2026-01-12,1.0
SOU IMOVEIS GESTAO DE NEGOCIOS IMOBILIARIOS LTDA,Full,1,4322,0.023,99.5394,C,2023-06-07,1.0
ALLIANCA IMOVEIS ARARAQUARA LTDA,Light,1,4323,0.023,99.5624,C,2025-01-15,1.0
MAVINC MARAJOARA CONSULTORIA IMOBILIÁRIA LTDA,Light,1,4324,0.023,99.5854,C,2025-08-01,1.0
ELITE NEGOCIOS IMOBILIARIOS LTDA,Full,1,4325,0.023,99.6085,C,2026-01-25,1.0
BMX ASSESSORIA IMOBILIARIA LTDA,Full,1,4326,0.023,99.6315,C,2025-08-09,1.0
VELOPE IMOVEIS LTDA,Full,1,4327,0.023,99.6545,C,2021-10-13,1.0
BRUM ADMINISTRADORA DE IMOVEIS LTDA,Full,1,4328,0.023,99.6776,C,2025-12-15,2.0
LEHOME NEGOCIOS IMOBILIARIOS LTDA,Full,1,4329,0.023,99.7006,C,2026-03-10,1.0
888 GESTAO EMPRESARIAL LTDA,Full,1,4330,0.023,99.7236,C,2025-07-28,1.0
KEILA ALVES DA SILVA,Full,1,4331,0.023,99.7467,C,2025-05-12,1.0
Light Safe - HABITAR ADMINISTRACAO DE IMOVEIS LTDA,Light,1,4332,0.023,99.7697,C,2025-09-05,1.0
FABIO LUIS DA SILVA TIBIRICA,Full,1,4333,0.023,99.7927,C,2025-02-14,1.0
CASTRO E BITENCOURT NEGÓCIOS IMOBILIÁRIOS LTDA,Full,1,4334,0.023,99.8158,C,2026-01-28,2.0
ACVIANA EMPREENDIMENTOS IMOBILIÁRIOS LTDA,Full,1,4335,0.023,99.8388,C,5450-07-15,2.0
MONTREAL IMOVEIS LTDA,Full,1,4336,0.023,99.8618,C,2025-12-05,2.0
RSANCHES IMÓVEIS SERVIÇOS DE CORRETAGEM LTDA,Full,1,4337,0.023,99.8848,C,2026-02-13,2.0
ÁLVARO MAIA ADMINISTRACAO DE IMOVEIS LTDA,Light,1,4338,0.023,99.9079,C,2026-02-07,1.0
EMPREENDIMENTOS IMOBILIARIOS ADRIANO E LUCILEIA LTDA,Full,1,4339,0.023,99.9309,C,2026-04-10,1.0
HELLO NEGOCIOS IMOBILIARIOS LTDA,Full,1,4340,0.023,99.9539,C,2025-08-08,2.0
RMX GESTAO IMOBILIARIA E INVESTIMENTOS LTDA,Full,1,4341,0.023,99.977,C,2025-07-29,1.0
REIS SOLUCOES IMOBILIARIA LTDA,Smart,1,4342,0.023,100.0,C,2025-08-01,1.0
Teste Parceiro UP - Full,Bank,0,4342,0.0,100.0,C,,nan
JC MAUER APOIO ADMINISTRATIVO S/S LTDA. - ME,Smart,0,4342,0.0,100.0,C,2021-09-15,nan
BARCALA IMOVEIS LTDA,Smart,0,4342,0.0,100.0,C,2022-06-01,nan
M. FERRO DE OLIVEIRA CORRETAGEM DE IMOVEIS LTDA,Smart,0,4342,0.0,100.0,C,2024-07-13,nan
QUELHAS IMOBILIARIA E CONSULTORIA LTDA,Smart,0,4342,0.0,100.0,C,2022-10-28,nan
BSBROKERS AGÊNCIA IMOBILIÁRIA LTDA,Smart,0,4342,0.0,100.0,C,2024-02-05,nan
LUCIO ORLANDO COSER,Smart,0,4342,0.0,100.0,C,2022-12-07,nan
KONFIA IMÓVEIS LTDA,Smart,0,4342,0.0,100.0,C,2022-12-08,nan
LENILTON DE SOUZA PAIXÃO,Smart,0,4342,0.0,100.0,C,2024-06-03,nan
NNI - NATRIELLI NEGÓCIOS IMOBILIÁRIOS LTDA.,Smart,0,4342,0.0,100.0,C,2022-09-01,nan
SEBASTIAN EDUARDO STABROWSKI BARRUECO,Smart,0,4342,0.0,100.0,C,2022-04-26,nan
CAPITOLIO IMOVEIS ADMINISTRACAO DE BENS LTDA,Smart,0,4342,0.0,100.0,C,2022-04-20,nan
CDOMINGUES SOLUÇÕES IMOBILIÁRIAS LTDA.,Smart,0,4342,0.0,100.0,C,2024-10-09,nan
CONNECT GESTÃO E MEDIAÇÃO IMOBILIÁRIA LTDA,Full,0,4342,0.0,100.0,C,2025-07-14,nan
SHEILA AUGUSTA DE OLIVEIRA FURTADO,Smart,0,4342,0.0,100.0,C,2023-09-18,nan
 RVEIGA IMÓVEIS LTDA,Smart,0,4342,0.0,100.0,C,2022-10-06,nan
MATER IMÓVEIS LTDA,Smart,0,4342,0.0,100.0,C,2023-01-23,nan
GRASSI ASSESSORIA IMOBILIARIA E CLIMATIZACAO LTDA,Smart,0,4342,0.0,100.0,C,2023-02-10,nan
PAULO DIAS IMOVEIS LTDA,Smart,0,4342,0.0,100.0,C,2024-01-05,nan
LUCIANI APARECIDA ESTIVALET FREITAS,Smart,0,4342,0.0,100.0,C,2022-12-03,nan
THAIS MOURA KNEIPP 07300606679,Smart,0,4342,0.0,100.0,C,2023-01-02,nan
HEBROM BROOKLIN IMOBILIÁRIA LTDA,Smart,0,4342,0.0,100.0,C,2024-07-11,nan
CÁSSIO ALEXANDRE PEREIRA DE BRITO JUNIOR 45007277878,Smart,0,4342,0.0,100.0,C,2022-11-08,nan
FABIO LUIS DA SILVA TIBIRICA,Smart,0,4342,0.0,100.0,C,2023-01-23,nan
Light - Valore Investimentos Imobiliarios LTDA,Smart,0,4342,0.0,100.0,C,2024-06-14,nan
I GO IMOBILIARIA LTDA.,Smart,0,4342,0.0,100.0,C,,nan
FELICIA MARIA LEITAO 14115081813,Smart,0,4342,0.0,100.0,C,2022-12-05,nan
MARCIO THOME LTDA.,Smart,0,4342,0.0,100.0,C,2023-03-24,nan
Light Bank - LUAGGE IMÓVEIS LTDA,Light,0,4342,0.0,100.0,C,2024-08-01,nan
Light Bank - LUAGGE IMÓVEIS LTDA,Smart,0,4342,0.0,100.0,C,2023-11-16,nan
LUCAS TSUJI SOARES,Smart,0,4342,0.0,100.0,C,2023-02-09,nan
CHAMOUN IMÓVEIS LTDA.,Full,0,4342,0.0,100.0,C,2024-09-30,nan
MARQUES E SUKIENIK LTDA,Smart,0,4342,0.0,100.0,C,2023-07-11,nan
IMÓVEIS SERRA GESTAO E ADMINISTRACAO IMOBILIARIA LTDA,Full,0,4342,0.0,100.0,C,2025-08-06,nan
IMÓVEIS SERRA GESTAO E ADMINISTRACAO IMOBILIARIA LTDA,Smart,0,4342,0.0,100.0,C,2024-05-22,nan
ANGELA BORBA,Smart,0,4342,0.0,100.0,C,2023-05-15,nan
START FLASH IMÓVEIS LTDA,Smart,0,4342,0.0,100.0,C,2023-06-15,nan
GALOREN GESTAO IMOBILIARIA LTDA,Smart,0,4342,0.0,100.0,C,2023-12-30,nan
Ítalo Francisco Nogueira De Castro,Smart,0,4342,0.0,100.0,C,2023-09-29,nan
CASTORINO BROKER LTDA,Smart,0,4342,0.0,100.0,C,2024-03-07,nan
CAROL MAIA NEGOCIOS IMOBILIARIOS LTDA,Smart,0,4342,0.0,100.0,C,2024-02-29,nan
Jamerson de Albuquerque Leal,Smart,0,4342,0.0,100.0,C,2024-05-01,nan
CLASS NEGÓCIOS IMOBILIARIOS LTDA,Full,0,4342,0.0,100.0,C,2024-06-01,nan
CLASS NEGÓCIOS IMOBILIARIOS LTDA,Smart,0,4342,0.0,100.0,C,2024-05-01,nan
OLIVEIRA E SILVA IMOVEIS LTDA,Smart,0,4342,0.0,100.0,C,2024-05-20,nan
"TOPBENS CORRETORA DE IMOVEIS, SEGUROS E REPRESENTACAO LTDA",Smart,0,4342,0.0,100.0,C,2023-12-10,nan
UP PARTNESS,Smart,0,4342,0.0,100.0,C,2025-01-23,nan
Light Growth - RODRIGUES E SILVA EMPREENDIMENTOS IMOBILIARIOS LTDA,Smart,0,4342,0.0,100.0,C,2024-07-01,nan
DIEGO VASCONCELOS COUTINHO,Full,0,4342,0.0,100.0,C,2024-08-30,nan
DIEGO VASCONCELOS COUTINHO,Smart,0,4342,0.0,100.0,C,2024-05-06,nan
ANDRE LUIS BISPO DOS SANTOS,Smart,0,4342,0.0,100.0,C,2024-12-06,nan
LIGHT GROWTH - ACHEI TAGUA EMPREENDIMENTOS LTDA,Smart,0,4342,0.0,100.0,C,2024-03-15,nan
LIGHT SAFE - NOVA ESPERANÇA IMÓVEIS LTDA,Light,0,4342,0.0,100.0,C,2024-08-23,nan
LIGHT SAFE - NOVA ESPERANÇA IMÓVEIS LTDA,Smart,0,4342,0.0,100.0,C,2024-05-13,nan
LIGHT GROWTH - IMOBILIARIA STEVAUX GALVAO LTDA,Smart,0,4342,0.0,100.0,C,,nan
LIGHT SAFE - OSMAR PINTO CORRETORA DE IMOVEIS LTDA,Smart,0,4342,0.0,100.0,C,2024-05-02,nan
COOPERAR IMOVEIS LTDA,Smart,0,4342,0.0,100.0,C,,nan
TORRE DE SANGREGORIO NEGOCIOS IMOBILIARIOS LTDA,Full,0,4342,0.0,100.0,C,2024-06-28,nan
Light Growth - DUEGATTI ASSESSORIA IMOBILIARIA LTDA,Light,0,4342,0.0,100.0,C,2024-05-15,nan
Light Growth - DUEGATTI ASSESSORIA IMOBILIARIA LTDA,Smart,0,4342,0.0,100.0,C,,nan
Light Growth - TIBOLA IMOVEIS LTDA,Light,0,4342,0.0,100.0,C,,nan
Light Growth - TIBOLA IMOVEIS LTDA,Smart,0,4342,0.0,100.0,C,,nan
Ligth Safe - CASA REAL ASSESSORIA HABITACIONAL LTDA,Light,0,4342,0.0,100.0,C,2024-05-10,nan
Light Safe - Adriano Augusto Dos Santos Nunes,Smart,0,4342,0.0,100.0,C,,nan
MAURI KESSLER LTDA,Smart,0,4342,0.0,100.0,C,2024-07-24,nan
Ronaldo Ferreira,Light,0,4342,0.0,100.0,C,2024-05-23,nan
Light Safe - A. B. DE LIMA CONSULTORIA IMOBILIARIA,Light,0,4342,0.0,100.0,C,2024-09-09,nan
CADASTRO DE CONTRATOS LIGHT,Light,0,4342,0.0,100.0,C,2025-03-28,nan
Light Growth - SB SOLUCOES IMOBILIARIAS LTDA,Light,0,4342,0.0,100.0,C,2024-09-01,nan
SQUADRA ENGENHARIA LTDA,Smart,0,4342,0.0,100.0,C,2021-10-22,nan
DHUO NEGOCIOS IMOBILIARIOS LTDA,Full,0,4342,0.0,100.0,C,2024-12-15,nan
Light- LUAGGE IMÓVEIS LTDA,Smart,0,4342,0.0,100.0,C,2023-04-01,nan
DAREDE ADMINISTRAÇÃO E NEGÓCIOS EMPRESARIAIS EIRELI,,0,4342,0.0,100.0,C,,nan
JOÃO MARCOS DA COSTA PRATES,,0,4342,0.0,100.0,C,,nan
GILVAN LIMA LACERDA,,0,4342,0.0,100.0,C,,nan
MARCELO IOVANOVISCHI,,0,4342,0.0,100.0,C,,nan
ADRIANO ARAUJO EMPREENDIMENTOS IMOBILIARIOS LTDA,,0,4342,0.0,100.0,C,,nan
FLAT IMOBILIÁRIA LTDA.,Full,0,4342,0.0,100.0,C,2025-02-06,nan
OPUS SERVIÇOS IMOBILIARIOS LTDA,,0,4342,0.0,100.0,C,,nan
RMJB CORRETORA DE IMOVEIS LTDA,,0,4342,0.0,100.0,C,,nan
DESTRA ASSESSORIA IMOBILIARIA LTDA,Full,0,4342,0.0,100.0,C,2025-03-20,nan
BATISTELLA ASSESSORIA IMOBILIARIA LTDA,Bank,0,4342,0.0,100.0,C,,nan
PRIME IMOVEIS GOIANIA LTDA,,0,4342,0.0,100.0,C,,nan
ARMANDO LUIS DA SILVA GOMES,,0,4342,0.0,100.0,C,,nan
GSR DE OLIVEIRA ADMINISTRADORA DE BENS IMÓVEIS,Smart,0,4342,0.0,100.0,C,,nan
MARIO PEREIRA DOS SANTOS,,0,4342,0.0,100.0,C,,nan
PARCERIA IMOVEIS BH LTDA,,0,4342,0.0,100.0,C,,nan
E DOS SANTOS SOUZA NEGOCIOS IMOBILIARIOS,,0,4342,0.0,100.0,C,,nan
Light Growth - RAPHAEL IMÓVEIS LTDA,Smart,0,4342,0.0,100.0,C,,nan
COUTO DUDA NEGOCIOS EIRELLI,,0,4342,0.0,100.0,C,,nan
JSF ENGENHARIA LTDA,,0,4342,0.0,100.0,C,,nan
LIGHT - AM IMOVEIS LTDA,Bank,0,4342,0.0,100.0,C,,nan
CONSULTEC CONSULTORIA IMOBILIARIA LTDA,,0,4342,0.0,100.0,C,,nan
LIGHT SAFE - MULTIHOUSE PRESTACAO SERVICOS LTDA,,0,4342,0.0,100.0,C,,nan
INVENTA MUNDO SOLUCOES SUSTENTAVEIS LTDA,,0,4342,0.0,100.0,C,,nan
SERRA & DIANNO ADMINISTRACAO E VENDAS DE IMOVEIS LTDA,Smart,0,4342,0.0,100.0,C,2026-04-10,nan
JUNGES & PINHAL NEGOCIOS IMOBILIARIOS LTDA- ME,,0,4342,0.0,100.0,C,,nan
FELIPE SANTOS SILVA,,0,4342,0.0,100.0,C,,nan
C. BALTAZAR ASSESSORIA IMOBILIÁRIA,,0,4342,0.0,100.0,C,,nan
WAYRONN W. L. GONCALVES CORRETOR DE IMOVEIS,,0,4342,0.0,100.0,C,,nan
IMÓVEIS IBITURUNA LTDA,,0,4342,0.0,100.0,C,,nan
GG IMOVEIS LTDA,Full,0,4342,0.0,100.0,C,2024-11-22,nan
ALIANCE IMOBILIARIA LTDA,Bank,0,4342,0.0,100.0,C,2025-02-14,nan
ALIANCE IMOBILIARIA LTDA,Light,0,4342,0.0,100.0,C,2024-11-08,nan
RAFAEL DE CAMPOS PONTES,Full,0,4342,0.0,100.0,C,2025-05-15,nan
EZEO IMÓVEIS LTDA,,0,4342,0.0,100.0,C,,nan
DATAKING CONTABILIDADE E IMOBILIARIA LTDA,,0,4342,0.0,100.0,C,,nan
CARLOS EDUARDO COSTA,,0,4342,0.0,100.0,C,,nan
PGX IMÓVEIS LTDA,,0,4342,0.0,100.0,C,,nan
VERANO IMOBILIÁRIA LTDA,,0,4342,0.0,100.0,C,,nan
Light Bank - LUAGGE IMÓVEIS LTDA,Bank,0,4342,0.0,100.0,C,2024-12-16,nan
DAVID OLIVEIRA ALVES FERREIRA,,0,4342,0.0,100.0,C,,nan
VOE FELICITA LTDA,,0,4342,0.0,100.0,C,,nan
LIGHT GROWTH - JOSE CARLOS APOCALYPSE NOGUEIRA,,0,4342,0.0,100.0,C,,nan
Light Safe - CURCIO NEGOCIOS IMOBILIARIOS LTDA,,0,4342,0.0,100.0,C,,nan
Agenciador 8,,0,4342,0.0,100.0,C,,nan
O. GONCALVES CELESTINO CONSULTORIA IMOBILIARIA,,0,4342,0.0,100.0,C,,nan
LIGHT GROWTH - ACHEX IMOVEIS LTDA,,0,4342,0.0,100.0,C,,nan
A B B MOUSINHO FILHO EIRELI,,0,4342,0.0,100.0,C,,nan
VIEIRA IMOVEIS LTDA,,0,4342,0.0,100.0,C,,nan
SANDY EMPREENDIMENTOS IMOBILIARIA LTDA,,0,4342,0.0,100.0,C,,nan
LIGHT GROWTH - RF7 IMÓVEIS LTDA,,0,4342,0.0,100.0,C,,nan
CIA DO IMOVEL LTDA,Full,0,4342,0.0,100.0,C,,nan
IMOBILIÁRIA SOARES E OLIVEIRA LTDA,,0,4342,0.0,100.0,C,,nan
JARBAS DIAS,,0,4342,0.0,100.0,C,,nan
LIGHT GROWTH - C&F ADMINISTRACOES E PARTICIPACOES LTDA,,0,4342,0.0,100.0,C,,nan
MONTELO IMOVEIS LTDA,Full,0,4342,0.0,100.0,C,2025-06-14,nan
Valore Imóveis - Acesso Érica,,0,4342,0.0,100.0,C,,nan
T2 - Análises Cadastral,,0,4342,0.0,100.0,C,,nan
ALLIANCA IMOVEIS ARARAQUARA LTDA,Full,0,4342,0.0,100.0,C,2025-01-15,nan
ALLIANCA IMOVEIS ARARAQUARA LTDA,Smart,0,4342,0.0,100.0,C,2024-09-11,nan
EDIVALDO APARECIDO LUBECK,,0,4342,0.0,100.0,C,,nan
MAIKON ROQUE DE MIRANDA DA SILVA,Smart,0,4342,0.0,100.0,C,2024-10-31,nan
Wilson Signorini - Analise cadastral,,0,4342,0.0,100.0,C,,nan
MAVINC MARAJOARA CONSULTORIA IMOBILIÁRIA LTDA,Full,0,4342,0.0,100.0,C,2025-07-13,nan
MC CORRETORA DE IMOVEIS IN VIX LTDA,,0,4342,0.0,100.0,C,,nan
Central de Vendas e Gestão de imóveis Ltda,,0,4342,0.0,100.0,C,,nan
DAMGAARD E NASCENTE IMOVEIS LTDA,,0,4342,0.0,100.0,C,,nan
MARCOS ROBERTO MONTEIRO - ME,Light,0,4342,0.0,100.0,C,2025-05-10,nan
AP IMÓVEIS LTDA.,,0,4342,0.0,100.0,C,,nan
Light- LUAGGE IMÓVEIS LTDA,Bank,0,4342,0.0,100.0,C,,nan
